{
  "$schema": "https://json-schema.org/draft/2020-12/schema",
  "$id": "idlekit/experience-output-v1",
  "type": "object",
  "required": ["mode", "design", "end", "session", "growth", "milestones", "perceived", "_meta"],
  "properties": {
    "mode": { "enum": ["deterministic", "monte-carlo"] },
    "design": { "type": "object" },
    "end": { "type": "object" },
    "session": { "type": "object" },
    "growth": { "type": "object" },
    "milestones": { "type": "object" },
    "perceived": { "type": "object" },
    "monteCarlo": { "type": "object" },
    "_meta": {
      "type": "object",
      "required": ["command", "contractVersion", "schemaRef", "cliVersion", "gitSha", "scenarioHash", "pluginDigest"],
      "properties": {
        "command": { "const": "experience" },
        "contractVersion": { "type": "string" },
        "schemaRef": { "const": "docs/schemas/experience.output.schema.json" },
        "cliVersion": { "type": "string" },
        "gitSha": { "type": "string" },
        "runId": { "type": "string" },
        "seed": { "type": "number" },
        "scenarioHash": { "type": "string" },
        "effectiveRunHash": { "type": "string" },
        "effectiveEngine": { "type": "string" },
        "stageScope": {
          "type": "object",
          "additionalProperties": {
            "type": "object",
            "required": ["strategy", "step", "fast", "session"],
            "properties": {
              "strategy": { "type": "boolean" },
              "step": { "type": "boolean" },
              "fast": { "type": "boolean" },
              "session": { "type": "boolean" }
            }
          }
        },
        "pluginDigest": { "type": "object", "additionalProperties": { "type": "string" } }
      }
    }
  }
}
